,datetime,text,cleanTweet,emotion
776,2023-01-03 07:36:21,"b'RT @CeletukWarga: Pangan bergizi terjangkau &amp; kemitraan petani dg konsumen buat petani sejahtera, kontrol atas operasional bisnis, industri\xe2\x80\xa6'",pangan gizi jangkau mitra tani konsumen buat tani sejahtera kontrol atas operasional bisnis,2
777,2023-01-03 07:36:12,"b'Konten komedi bule2 seru bgt dan ga lama, cuma 15 detik tp bkin ngakak. Bahkan ada yg dibawah 10 detik wkwk'",konten komedi bule2 seru bgt ga lama cuma detik tp bkin ngakak bahkan bawah detik wkwk,2
778,2023-01-03 07:34:26,"b'dia yang meminta untuk tidak pergi , tapi nyata nya dia yang pergi. Puncak komedi seperti apa ini HAHAHA'",minta pergi nyata nya pergi puncak komedi apa hahaha,2
779,2023-01-03 07:33:20,"b'Industri komedi sepertinya bener bener pulih. \n\nKalo semua komedian favorit ku tonton, kayaknya weekend ku penuh terus sampe tos tosan ama yesus di teater.'",industri komedi seperti bener bener pulih semua komedian favorit ku tonton kayak weekend ku penuh terus sampe tos tosan ama yesus teater,2
780,2023-01-03 07:28:11,"b'@izumijjang Hidup aruna udah banyak komedi, kalo sama rinne makin banyak https://t.co/8BfbJKhxT2'",hidup aruna udah banyak komedi kalo sama rinne makin banyak,2
781,2023-01-03 07:28:07,"b'RT @mito_is_real: @KhhFess dia kan waktu cilik jadi minority di wollongong, karena dia wajahnya asia timur akhirnya temennya nanya \xe2\x80\x9ckamu so\xe2\x80\xa6'",waktu cilik jadi minority wollongong wajah asia timur akhir temennya nanya,2
782,2023-01-03 07:27:33,b'komedi sih https://t.co/iRNAFtgVGn',komedi sih,1
783,2023-01-03 07:27:28,b'Percayalah padaku! Kamu akan kecanduan cerita ini!\n \n#komiklokalindonesia #artidn #komedi #Bahasaindonesia\n\nhttps://t.co/CDjVbUDZfF https://t.co/ApAQMzLO5G',percaya kamu candu cerita,1
784,2023-01-03 07:27:14,"b'@buwyer diputerin aja biar jadi komedi putar, seru'",diputerin aja biar jadi komedi putar seru,1
785,2023-01-03 07:26:11,"b'Gue nonton film ini masih enjoy, karena biasanya emang nonton film romantis/komedi-romantis. Kalo kelen yg ga biasa mungkin ngerasa bosen. Soalnya ini emang tipikal film romantis yg gitu doang, nothing special. Tapi kalo mau liat aspek lain nih film tuh masih tergolong oke \xf0\x9f\x91\x8c'",gue nonton film enjoy biasa emang nonton film kalo kelen ga biasa mungkin ngerasa bosen soal emang tipikal film romantis gitu doang nothing special kalo mau liat aspek nih film tuh golong oke,2
786,2023-01-03 07:26:11,"b'Ini film komedi-romantis, kalo liat genrenya di Disney+ Hotstar. Hmm kocak si, tapi tuh bukan karena bertebaran banyolan atau tingkah konyol ya, lebih ke karena keadaan ruwetnya. Jadi ini bukan kocak yang beneran kocak, alias genre komedi nggak ada jatohnya romantis doang \xf0\x9f\xa4\xb7\xe2\x80\x8d\xe2\x99\x80\xef\xb8\x8f'",film kalo liat genre hotstar hmm kocak si tuh bukan tebar banyol tingkah konyol lebih ada ruwet jadi bukan kocak beneran kocak alias genre komedi jatohnya romantis doang,2
787,2023-01-03 07:24:43,b'Komedi dunia',komedi dunia,2
788,2023-01-03 07:24:30,b'@lazyhoneybee_ gpp hidupnya aruna banyak komedi ntar \xf0\x9f\x98\xb3\xf0\x9f\x98\xb3\xf0\x9f\xa4\xb2\xf0\x9f\xa4\xb2',gpp hidup aruna banyak komedi ntar,2
789,2023-01-03 07:24:23,b'Aku tidak sabar menunggu apa yang terjadi selanjutnya! Klik tautan di bawah ini dan bergabunglah dengan penderitaanku!\n \n#komiket #komikindonesia #komikon #komedi\n\nhttps://t.co/LpzqNyimgz https://t.co/R8qxkCHoyc',aku sabar tunggu apa jadi klik taut bawah gabung,2
790,2023-01-03 07:21:52,"b'Malam tadi menonton komedi dari Brazil dan depa sebut \xe2\x80\x98igreja\xe2\x80\x99 untuk merujuk gereja kristian. Pengaruh Portugis tak banyak, tapi masih ada impak dalam Bahasa Melayu yang dipakai di Malaysia. https://t.co/9eOq1FzT3R'",malam tadi tonton komedi brazil depa sebut rujuk gereja kristian pengaruh portugis banyak impak bahasa melayu pakai malaysia,2
791,2023-01-03 07:20:04,b'Ini sebenernya mvs erotis atau komedi sih? \xf0\x9f\x98\xad https://t.co/dqpeMZhW9Y',sebenernya mvs erotis komedi sih,1
792,2023-01-03 07:19:24,"b'Nyari duit sampe stress, dapet duit untuk ngilangin stress. Tragedi tapi komedi. Haha'",nyari duit sampe stress dapet duit ngilangin stress tragedi komedi haha,2
793,2023-01-03 07:19:18,b'Komedi di 2022 yang masih berlanjut ke 2023',komedi lanjut,0
794,2023-01-03 07:17:18,b'@AREAJULID wkwkwkwkwkwk gasopan tapi lucu sih pulisinya kaya di filem\xc2\xb2 komedi wkwkwk sayangnya kenyataan wkekwk',wkwkwkwkwkwk gasopan lucu sih pulisinya kaya komedi wkwkwk sayang nyata wkekwk,2
795,2023-01-03 07:17:09,b'anjgg knp hdup gwe komedi sih cokkkk',anjgg knp hdup gwe komedi sih cokk,1
796,2023-01-03 07:16:39,b'hidup gw komedi putar',hidup gw komedi putar,2
797,2023-01-03 07:14:34,"b'Dah selesai nonton ini, overal 8,5/10\xf0\x9f\x91\x8c\xf0\x9f\x8f\xbb\xf0\x9f\x91\x8c\xf0\x9f\x8f\xbb ga boong ni bagus bgt, say no to adegan cringe\xf0\x9f\x98\xab\xf0\x9f\x98\xab komedi dan fluff nya jg MUACH AK SUKA AHAHHAH https://t.co/J3McMkCCTx'",dah selesai nonton overal ga boong ni bagus bgt say no to adegan komedi fluff nya jg muach ak suka ahahhah,2
798,2023-01-03 07:14:34,"b'@DraftAnakUnpad ringan buat ditonton sih filmnya, ceritanya mayan lah, banyak permasalahan keluarga juga yang bawa di film itu, tapi menurut gue banyak komedi yang terlalu dipaksain. Kalo seru lebih seru pertama menurut gue tapi yang kedua juga masih tetep seru buat ditonton'",ringan buat tonton sih film cerita mayan lah banyak masalah keluarga bawa film gue banyak komedi terlalu dipaksain kalo seru lebih seru pertama gue dua tetep seru buat tonton,2
799,2023-01-03 07:11:50,"b'Komedi hari ini, dah haha huhuu masuk trs 3 minggu tapi absenku ga ke detect\xf0\x9f\x99\x83'",komedi hari dah haha huhuu masuk trs minggu absen ga,2
800,2023-01-03 07:11:50,"b'@fessthai tapi yang paling berkesan tuh emang yang awalnya komedi tapi jadi angst kayak the shipper sih, awalan nonton ngga nyangka aja endingnya bakal begitu :)'",paling kesan tuh emang awal komedi jadi angst kayak the shipper sih awal nonton ngga nyangka aja endingnya bakal,2
801,2023-01-03 07:11:35,"b'@ARTIST_EUNJl Yah betuul, sambil mabok yah kita njii \xf0\x9f\x98\x82\xf0\x9f\x8d\xba suka banget nonton wldn soalnya komedi dan ringan gitu, bikin ngakak \xf0\x9f\x98\x82 membuat weekendku jadi bahagia'",yah betuul mabok yah njii suka banget nonton wldn soal komedi ringan gitu bikin ngakak buat weekendku jadi bahagia,2
802,2023-01-03 07:10:14,b'puncak komedi 2023 semua foto gw ilang',puncak komedi semua foto gw ilang,1
803,2023-01-03 07:10:01,"b'\xf0\x9f\xa4\x8d rekomen drakor komedi romantic dong, TIA'",rekomen drakor komedi romantic dong tia,2
804,2023-01-03 07:09:37,b'@alfarosiyoga malah disuruh standup komedi',malah suruh standup komedi,2
805,2023-01-03 07:09:29,b'@mukaikhlas hidoep selaloe adalah komedi!',hidoep selaloe,1
806,2023-01-03 07:08:49,b'@mcflurryenaaaa puncak komedi hahaha',puncak komedi hahaha,2
807,2023-01-03 07:07:42,"b'lah????? redflag nya bnyak bgt wkwk, puncak komedi ni sender https://t.co/nG4xADVJVc'",lah redflag nya bnyak bgt wkwk puncak komedi ni sender,1
808,2023-01-03 07:04:58,b'Manhwa ini luar biasa! Aku selalu ketagihan!\n \n#komikon #komikharian #komiker #komedi\n\nhttps://t.co/uppHxkQD5v https://t.co/nkR10Dnq67',manhwa luar aku selalu,1
809,2023-01-03 07:02:41,b'Emang hidup dibuat genre komedi aja. + komedian paling jenaka ya siapa lagi. Gusti Pangeran',emang hidup buat genre komedi aja komedian paling jenaka siapa gusti pangeran,2
810,2023-01-03 07:02:05,b'@ArditErwandha Tidak ada komedi di video ini. Tapi nomor whatsapp bang aguero masih ada kan bang?',komedi video nomor whatsapp bang aguero bang,0
811,2023-01-03 07:00:31,b'Neo hidupnya komedi beneran \xf0\x9f\x98\xad\xf0\x9f\x98\xad\xf0\x9f\x98\xad https://t.co/52QT0grt3A',neo hidup komedi beneran,2
812,2023-01-03 06:59:40,b'Manhwa ini luar biasa! Aku selalu ketagihan!\n \n#Komikus #manga #komedi #komikinajah\n\nhttps://t.co/ZUSOqvaPZO https://t.co/j8QTed2b0K',manhwa luar aku selalu,1
813,2023-01-03 06:57:41,b'RT @kinatweiss: \xf0\x9f\x98\xad\xf0\x9f\xa4\xa3 iya.. kadang kayak puncak komedi banget deh baru seneng dikit udah.. \xf0\x9f\x98\xad\xf0\x9f\xa4\xa3',iya kadang kayak puncak komedi banget deh baru neng dikit udah,1
814,2023-01-03 06:55:09,b'@WatchmenID Ga tertarik film komedi',ga tarik film komedi,2
815,2023-01-03 06:54:21,"b'@nctzenbase inituh beneran komedi poll, kl dia worry trsmikir kearah sana knp mesti bikin video sih. kaya aneh amat sih hal yg blm ada konfirmasi ofc apa2 dibuat konten'",inituh beneran komedi poll kl worry trsmikir arah sana knp mesti bikin video sih kaya aneh sih blm konfirmasi ofc apa2 buat konten,2
816,2023-01-03 06:52:21,b'Yah begitu. Teruslah ngehate sampe yang dihate menjadi lebih baik dari siapapun dik. Karena hidup ini adalah puncak komedi.',yah terus ngehate sampe dihate jadi lebih baik siapa dik hidup puncak komedi,2
817,2023-01-03 06:51:35,"b'@MaduBangGarr @flyn2dmoon @iin1892 Hihi bener ya, efek kebiasaan nontn komedi romance. Dulu pernah nontn the penthouse aja lansung trauma aku mh bun\xf0\x9f\x98\x85\xf0\x9f\x98\x85'",hihi bener efek biasa nontn komedi romance dulu pernah nontn the penthouse aja lansung trauma aku mh,2
818,2023-01-03 06:50:25,b'\xf0\x9f\x98\xad\xf0\x9f\xa4\xa3 iya.. kadang kayak puncak komedi banget deh baru seneng dikit udah.. \xf0\x9f\x98\xad\xf0\x9f\xa4\xa3 https://t.co/tzSC0gulgX',iya kadang kayak puncak komedi banget deh baru neng dikit udah,1
819,2023-01-03 06:50:04,b'@nctzenbase Apaan sih anjer WKWKWKWKW KOMEDI',apa sih anjer wkwkwkwkw komedi,1
820,2023-01-03 06:49:39,b'suka komedi bukan berarti hidup gue harus di bercandain juga ngen\xf0\x9f\x99\x8f\xf0\x9f\x8f\xbb',suka komedi bukan arti hidup gue bercandain,2
821,2023-01-03 06:49:28,b'Hebatt banget keluar kota sendirian\xf0\x9f\x98\x82komedi sekali\xf0\x9f\x99\x8f\xf0\x9f\x8f\xbc\xf0\x9f\x98\x82\xf0\x9f\x98\x82',hebatt banget keluar kota,2
822,2023-01-03 06:46:36,b'@TalithaFarahK Awkoakao komedi banget emang\xf0\x9f\x98\xad makasi anwwww',awkoakao komedi banget makas anww,2
823,2023-01-03 06:45:35,b'@GlenEray Komedi falan filan',komedi falan filan,2
824,2023-01-03 06:39:34,b'@kdrama_menfess Aman banget . Cocok ko . Ini komedi nder . Bikin ngakak',aman banget cocok ko komedi nder bikin ngakak,2
825,2023-01-03 06:39:26,b'RT @DEMOKRATPARTAF3: Hukuksal komedi Loading ... https://t.co/w2dpRVg2Ow',hukuksal komedi loading,1
826,2023-01-03 06:39:18,b'@ShinMonday @convomfs HAHAHAHA DEPOOOOKK YAALLAHH \xf0\x9f\x98\xad\xf0\x9f\x98\xad\xf0\x9f\x98\xad\xf0\x9f\x98\xad\xf0\x9f\x98\xad kota paling komedi di indonesia',hahahaha depookk yaallahh kota paling komedi indonesia,1
827,2023-01-03 06:39:00,"b'penonton ikut terbawa suasana dlm drama. Tak lp komedi oleh KRW &amp; #KangKiDong bener2 suka bikin geleng kepala, cocok bgt! Banyak ilmu yg kita tau tanpa perlu berpikir disini mengenai bahaya kebakaran oleh #SonHojun. Tiap eps akan menampilkan kasus &amp; kode darurat berbeda. Meski https://t.co/wU4EwUmTzK'",tonton ikut bawa suasana dlm drama lp komedi krw bener2 suka bikin geleng kepala cocok banyak ilmu tau perlu pikir sini kena bahaya bakar tiap eps tampil kasus kode darurat beda meski,2
828,2023-01-03 06:37:21,b'Ratu di Alam Mimpi benar-benar komik yang istimewa! Sampai terus terpikirkan!\n \n#komedi #Indonesia #komiker #indiecomics\n\nhttps://t.co/jvGcE2T5cy https://t.co/49K9XOcAWm',ratu alam mimpi komik terus,2
829,2023-01-03 06:32:14,b'puncak komedi (2) https://t.co/F2rZ9IhkgK',puncak komedi,1
830,2023-01-03 06:31:01,b'@jmnnaa_ Gua ngakak bgt anjir. Org2 tiktok knp pada bilang kalo nct bakalan hiatus juga sih\xf0\x9f\x98\x85\xf0\x9f\x98\x82\xf0\x9f\xa4\xa3 komedi',gua ngakak bgt anjir org2 tiktok knp bilang kalo nct bakal hiatus komedi,2
831,2023-01-03 06:29:15,"b'Gak nyangka baca ""Girls"" Minato Kanae aku bisa sampai pada titik dark komedi. Ngeri, tapi lucu. Kebaikan yang diawali dari niat buruk itu bisa membawa pada kengerian tak terbayangkan. Hahaha. \xf0\x9f\x98\x86\xf0\x9f\x93\x9a\xe2\x98\x95'",nyangka baca girls minato kanae aku titik dark komedi ngeri lucu baik awal niat buruk bawa ngeri bayang hahaha,2
832,2023-01-03 06:27:17,b'Komedi banget hidup gua.',komedi banget hidup gua,2
833,2023-01-03 06:25:59,b'Aduh komedi komedii terus',aduh komedi komedi terus,2
834,2023-01-03 06:25:11,b'@animefess_ deaimon!! lebih ke sol sihh tapi ada bumbu komedi nya juga',lebih sol sihh bumbu komedi nya,1
835,2023-01-03 06:19:43,b'puncak komedi.\xf0\x9f\x98\x83\xf0\x9f\x98\x83\xf0\x9f\x98\x83\xf0\x9f\x98\x83\xf0\x9f\x98\x83',puncak,1
836,2023-01-03 06:15:22,"b'@schfess puncak komedi nder, temen gue banyak yg daftar pake piagam palsu, fyi piagamnya dibuatin sama pihak sekolah\xf0\x9f\x92\x80'",puncak komedi nder temen gue banyak daftar pake piagam palsu fyi piagam dibuatin sama pihak,2
837,2023-01-03 06:14:38,"b'yg di fandomnya belain dia, lo di bodohin anjir. dia gak nonton, cuma ngambil kesimpulan dari ss-an doang. puncak komedi https://t.co/wT6RhVyFyo'",fandomnya bain lo bodohin anjir nonton cuma ngambil simpul doang puncak komedi,2
838,2023-01-03 06:14:31,b'Percayalah padaku! Kamu akan kecanduan cerita ini!\n\n#bilibilicomics #komiklokalindonesia #komikharian #komedi\n https://t.co/hwfe6q0Z5L https://t.co/qzj2HEyc94',percaya kamu candu cerita,1
839,2023-01-03 06:13:53,"b'@oddmiere sejauh ini aku baru nonton 4 eps, ratingku 9/10 krn aku relate sm beberapa hal dari karakternya trs lagu""nya seru wkwkw animenya lucu nyerempet komedi soalnya'",jauh aku baru nonton eps ratingku aku relate sm beberapa karakter trs seru wkwkw animenya lucu nyerempet komedi soal,2
840,2023-01-03 06:12:43,"b'HIATUS HIATUS PALA BAPAK LO SENGKLEK, KLO MAU BUAT KOMEDI AWAL TAHUN GA BGITU KONSEPNYA YE SAY'",hiatus hiatus pala bapak lo sengklek klo mau buat komedi awal tahun ga bgitu konsep ye say,2
841,2023-01-03 06:12:37,b'Komik yang luar biasa ini harus mendapat perhatian lebih!\n \n#komedi #komiker #Komikus #manga\n\nhttps://t.co/T0MLoS06HY https://t.co/VABOQn0uEX',komik luar biasa dapat perhati,2
842,2023-01-03 06:10:33,"b'Dunia adalah komedi bagi mereka yan memikirkannya, atau tragedi bagi mereka yang merasakannya.'",dunia komedi yan pikir tragedi rasa,2
843,2023-01-03 06:09:56,"b'RT @foreadinonly: 8/10\nMEET DEPTAA!! Pasangab tergemes ya lord. Gue ga tau mau bilang apa lagi sakin gemesnya. Gue cape nyengir, perut gue\xe2\x80\xa6'",pasangab tergemes lord gue ga tau mau bilang apa sakin gemesnya gue cape nyengir perut,2
844,2023-01-03 06:08:27,"b'@Skzchan2911 Hahahha dia paling komedi sih kak, spill acc barunya dong kak'",hahahha paling komedi sih kak spill acc baru dong kak,2
845,2023-01-03 06:06:43,b'Puncak komedi https://t.co/9RvVM3L7wx https://t.co/uL7xUBAKK9',puncak komedi,1
846,2023-01-03 06:05:23,"b'Rada bingung dan ngantuk nonton ini, tapi akhir-akhir oke lah. \n\nTitanic tapi dengan kritik sosial dan komedi satir. \n\nAda di Klik Film. https://t.co/zBprNpKcey'",rada bingung ngantuk nonton oke lah kritik sosial komedi satir klik film,2
847,2023-01-03 06:05:04,b'AHY Komedi Politik #AHYpolitikusGagal #AHYAsalBicara #SBYMangkrakAHYAsbun #AHYGagaldiTNIGagaldiPolitik #AHYgagalNyapres #HambalangMangkrak #SBYTurunGunung #DemokratKoruptor #AHYbaukencur https://t.co/T6Crsuenz1',ahy komedi politik,0
848,2023-01-03 06:04:09,b'Komik yang luar biasa ini harus mendapat perhatian lebih!\n\n#komikindo #komiklokalindonesia #komedi #indiecomics\n https://t.co/DRLVZQxblN https://t.co/qneAhUaaEY',komik luar biasa dapat perhati,2
849,2023-01-03 06:02:15,"b'Rian Johnson Membuat Tone yang Berbeda pada Knives Out 2\n\nTernyata bukan karena ketidaksengajaan, namun memang dari sang sutradara Rian Johnson ingin membuat film ini berbeda. Kita akan merasakan Glass Onion seperti misteri yang ringan dan penuh dengan komedi https://t.co/HHDMnuRUGn'",rian johnson buat tone beda knives out bukan ketidaksengajaan memang sang sutradara rian johnson buat film beda rasa glass onion misteri ringan penuh komedi,2
850,2023-01-03 06:02:14,"b'INI BARU FILM DETEKTIF! Glass Onion\n\nMasih mempertahankan trend positif, sekuel kedua dari Knives Out yang berjudul Glass Onion sukses dicintai oleh para penontonnya. Kali ini ceritanya lebih ringan dan penuh dengan komedi. Buat yang masih ragu mau nonton boleh baca faktanya dulu https://t.co/UAYxt5ns44'",baru film glass tahan trend positif sekuel dua knives out judul glass onion sukses cinta tonton kali cerita lebih ringan penuh komedi buat ragu mau nonton baca fakta dulu,2
851,2023-01-03 05:59:05,b'Hidup adalah komedi bagi siapa yang hidupnya dengan akal. Dan merupakan tragedi bagi siapa yang hidup dengan emosi.',hidup komedi siapa hidup akal rupa tragedi siapa hidup emosi,2
852,2023-01-03 05:56:51,b'abis nikah genre hidup mereka komedi anjir ketawa banget gue https://t.co/k7eFUn5EPd',abis nikah genre hidup komedi anjir ketawa banget gue,2
853,2023-01-03 05:56:21,b'@ilvtaegii @oohnayy Puncak komedi \xf0\x9f\x98\xad',puncak komedi,1
854,2023-01-03 05:55:32,b'Ini nggak di-mention pun adem2 bae. Komedi dunia maya.',adem2 bae komedi dunia maya,2
855,2023-01-03 05:52:40,"b'@The_RedsIndo @SLBenfica Bersama mas Nyunyes menuju puncak,puncak komedi \xf0\x9f\xa4\x9c\xf0\x9f\x98\xad\xf0\x9f\xa4\x9b'",sama mas nyunyes tuju komedi,2
856,2023-01-03 05:51:54,b'Aku suka gaya gambar Kisah Seorang Penasihat Roh! Bagus banget! Desain karakternya juga hebat! Pantas untuk direkomendasikan!\n \n#komiklucu #komedi #komikon #komikislam\n\nhttps://t.co/tSTLSdJ3Hj',aku suka gaya gambar kisah orang nasihat bagus desain karakter pantas,2
857,2023-01-03 05:49:35,"b'Bacanya udah merinding, eh liat komenan di bawahnya jadi cerita komedi\xf0\x9f\x98\xad https://t.co/pIBcTQLt0j https://t.co/Io9h0kxdGd'",baca udah merinding eh liat komenan bawah jadi cerita,2
858,2023-01-03 05:48:35,"b'komedi awal tahun, semangat semangat!'",komedi awal tahun semangat,2
859,2023-01-03 05:46:11,b'@anotherviaa Wkwkw puncak komedi',wkwkw puncak komedi,2
860,2023-01-03 05:44:37,b'komedi awal taun ajg wkwkwkkw',komedi awal taun ajg wkwkwkkw,2
861,2023-01-03 05:40:48,b'Komik yang luar biasa ini harus mendapat perhatian lebih!\n \n#komiket #komedi #manga #komikindonesia\n\nhttps://t.co/rlaezHjPas https://t.co/EMZCJ49YvN',komik luar biasa dapat perhati,2
862,2023-01-03 05:40:32,"b'komedi putar, btumbuk kyta sp yg blang bgitu???! https://t.co/YWwEGIOYoZ'",komedi putar btumbuk kyta sp blang,2
863,2023-01-03 05:37:12,b'@bakul_mantel Puncak komedi',puncak komedi,1
864,2023-01-03 05:34:44,"b'kenapa hidupku penuh komedi ya jujur cpk bgt, ya Allah masih keinget yg semalem'",hidup penuh komedi jujur cpk bgt allah keinget semalem,2
865,2023-01-03 05:34:31,b'@ucancallmefa @justiimalatsary @bagihumor Ya selera komedi orang beda-beda. Tetep ada saja kok pasarnya. Who are you to judge? \nhttps://t.co/4BZruKaumR',selera komedi orang tetep kok pasar who are you to judge,2
866,2023-01-03 05:34:02,b'wkwkwkwkwkw pucak komedi',wkwkwkwkwkw pucak komedi,2
867,2023-01-03 05:30:09,"b'Pangan bergizi terjangkau &amp; kemitraan petani dg konsumen buat petani sejahtera, kontrol atas operasional bisnis, industrialisasi dari bawah, pendidikan sesuai konteks &amp; kebutuhan, fasilitasi minat, bisa terus gali pengetahuan sembari nulis sajak &amp; nonton teater terutama komedi'",pangan gizi jangkau mitra tani konsumen buat tani sejahtera kontrol atas operasional bisnis industrialisasi bawah didik sesuai konteks butuh fasilitas minat terus gali tahu sembari nulis sajak nonton teater utama komedi,2
868,2023-01-03 05:29:17,"b'Mengawali awal tahun dengan nonton drama thriller, mistery, pembunuhan, bacok-bacokan cukup membuat migrain meskipun seru banget. Wishlistnya setelah ini mau nonton drama komedi aja kayaknya.'",awal awal tahun nonton drama thriller mistery bunuh cukup buat migrain meski seru banget wishlistnya mau nonton drama komedi aja kayak,2
869,2023-01-03 05:27:54,b'ketawa dulu dong puncak komedi ini https://t.co/H6K2AoJ6dE',ketawa dulu dong puncak komedi,2
870,2023-01-03 05:27:02,b'Aku tidak sabar menunggu apa yang terjadi selanjutnya! Klik tautan di bawah ini dan bergabunglah dengan penderitaanku!\n \n#komikislam #Komikus #artidn #komedi\n\nhttps://t.co/X818bdI10A https://t.co/xP5nxtQf7T',aku sabar tunggu apa jadi klik taut bawah gabung,2
871,2023-01-03 05:25:54,b'Drakor `Brain Works` tampilkan komedi bromantic berbalut sains\nhttps://t.co/eqeAlNpxJh https://t.co/0DCO6PvAtS',drakor tampil komedi bromantic balut,2
872,2023-01-03 05:25:03,"b'Disutradarai Kim Kyung Won, film ini mengikuti Ji Hyun Soo (diperankan oleh Ju Ji Hoon), seorang detektif swasta yang dituduh menculik kliennya. https://t.co/h72bBpiXSB https://t.co/WdWCw1F0Tj'",sutradara kim kyung won film ikut ji hyun soo ju ji orang detektif swasta tuduh culik klien,2
873,2023-01-03 05:23:28,b'Aku suka gaya gambar Kesenangan Pangeran Jahat Berhati Dingin! Bagus banget! Desain karakternya juga hebat! Pantas untuk direkomendasikan!\n \n#Bahasaindonesia #komiklokalindonesia #manga #komedi\n\nhttps://t.co/dbezYwTYQ3 https://t.co/TFlZR9prk9',aku suka gaya gambar senang pangeran jahat hati bagus desain karakter pantas,1
874,2023-01-03 05:17:58,b'AHY Komedi Politik #AHYpolitikusGagal #AHYAsalBicara #SBYMangkrakAHYAsbun #AHYGagaldiTNIGagaldiPolitik #AHYgagalNyapres #HambalangMangkrak #SBYTurunGunung #DemokratKoruptor #AHYbaukencur https://t.co/gE6I98a9Ki',ahy komedi politik,0
875,2023-01-03 05:17:22,"b'Genre hidup gue emang komedi-romansa, gue komedinya, orang di sekitar gue romansanya.'",genre hidup gue emang gue komedi orang gue romansa,2
876,2023-01-03 05:16:27,"b'padahal kemaren udah sedih ovt pas dongi ngomong mereka udah ga sedorm, ternyata mereka rumahnya deketan COYYY KOMEDI BGT INI HIDUP JADI KONIC\xf0\x9f\x98\xad\xf0\x9f\x98\xad\xf0\x9f\x98\xad\xf0\x9f\x98\xad\xf0\x9f\x98\xad\xf0\x9f\x98\xad\xf0\x9f\x98\xad\xf0\x9f\x98\xad\xf0\x9f\x98\xad\xf0\x9f\x98\xad'",padahal kemaren udah sedih ovt pas dong ngomong udah ga sedorm nyata rumah deketan coyy komedi bgt hidup jadi,2
877,2023-01-03 05:15:58,b'Sang Raja Naga yang menjadi Petualang Amatir benar-benar komik yang istimewa! Sampai terus terpikirkan!\n \n#komedi #artidn #komik #Komikus\n\nhttps://t.co/by8wPxsTrM https://t.co/W6PJY7DNHr',sang raja naga jadi tualang amatir komik terus,2
878,2023-01-03 05:13:32,b'RT @bbomedya: SARI KART.\n\nKOMED\xc4\xb0. https://t.co/eb2bJUkRVP',sari,1
879,2023-01-03 05:12:44,b'Komedi awal tahun\xf0\x9f\x98\x82. https://t.co/XfKXK9WhPb',komedi awal,1
880,2023-01-03 05:12:32,"b'RT @IDNTimesKorea: 10 Fakta Karakter Film Hi.5, Kisah Fantasi-Komedi Pahlawan Pemula https://t.co/IQOjzOMf21'",fakta karakter film kisah pahlawan mula,2
881,2023-01-03 05:12:02,"b'10 Fakta Karakter Film Hi.5, Kisah Fantasi-Komedi Pahlawan Pemula https://t.co/IQOjzOMf21'",fakta karakter film kisah pahlawan mula,2
882,2023-01-03 05:11:40,"b'@The_RedsIndo Ngebuang mane buat seorang tulang punggung komedi, respect \xf0\x9f\x91\x8f'",ngebuang mane buat orang tulang punggung komedi respect,2
883,2023-01-03 05:10:16,b'Manhwa ini luar biasa! Aku selalu ketagihan!\n \n#bilibilicomics #komikinajah #komedi #indiecomics\n\nhttps://t.co/sNgWlc27K9 https://t.co/9Rk8NZFFMM',manhwa luar aku selalu,1
884,2023-01-03 05:09:54,b'Jalan cerita Dewa Bela Diri Asura membawa perasaan naik turun. Komik yang memukau dan penuh kejutan!\n \n#komedi #komik #komikindo #komikharian\n\nhttps://t.co/r39vVeOBgm https://t.co/7ujcvRz9X7',jalan cerita dewa bela diri asura bawa asa naik turun komik pukau penuh,0
885,2023-01-03 05:08:43,b'Pacarku adalah Iblis Kecil benar-benar komik yang istimewa! Sampai te\nrus terpikirkan!\n \n#komikstrip #komedi #komiklucu #komiker\n\nhttps://t.co/EWX6fr4m45 https://t.co/Yzu075OJdX',pacar iblis kecil komik,2
886,2023-01-03 05:05:05,b'Puncak komedi awal tahun gini banget ya https://t.co/ieb0DHenTe',puncak komedi awal tahun gin banget,2
887,2023-01-03 05:04:30,"b'Daengku, ini jadwal bioskop Makassar hari ini. Berbagai genre mulai dari horor sampai komedi. \nhttps://t.co/DA0I5Xw7JD'",daeng jadwal bioskop makassar hari bagai genre mulai horor komedi,2
888,2023-01-03 05:03:44,b'puncak komedi https://t.co/3s3RHYr9VQ',puncak komedi,1
889,2023-01-03 05:02:54,b'@straykijeuuu_ paling komedi di 2023',paling komedi,2
890,2023-01-03 05:01:35,b'@jjejaem_n @nctzenbase puncak komedi',puncak komedi,1
891,2023-01-03 05:00:57,"b'Trend tiktok, gak semua obat capek istirahat, bisa jadi....\n\nPingin ngonten bisa jadi obatnya suicide \xf0\x9f\xa5\xb9\xf0\x9f\xa4\xa3\n\nMoralku lagi jalan jalan ges untuk komedi'",trend tiktok semua obat capek istirahat ngonten jadi obat suicide jalan jalan ges komedi,1
892,2023-01-03 05:00:51,b'RT @awesomeyoit: 37. Puncak komedi https://t.co/OTPs4LEV21',puncak komedi,1
893,2023-01-03 05:00:39,b'@recehtapisayng Puncak komedi',puncak komedi,1
894,2023-01-03 04:59:57,"b'Komedi banget, ketemu mantannya mantan wkwk dunia emang sempit \xf0\x9f\xa4\x8c\xf0\x9f\x8f\xbb'",komedi banget ketemu mantan mantan wkwk dunia emang sempit,2
895,2023-01-03 04:57:24,b'@moonareas puncak komedi emang',puncak komedi emang,2
896,2023-01-03 04:55:13,"b'\xe2\x80\xa2kdm\xe2\x80\xa2 Film Men of Plastic, film nya Ma Dong Seok, Jung Kyung Ho dan Oh Nara. Film komedi nih guys! Tayang mulai besok di cgv! Ayokk nonton di bioskop!\xf0\x9f\xa5\xb0 https://t.co/TSIak4cBxv'",film men of plastic film nya ma dong seok jung kyung ho nara film komedi nih tayang mulai besok ayokk nonton,2
897,2023-01-03 04:54:01,b'RT @IrHadiAmat: Ini mmg kelakar. Janji PH masa kempen PRU15 diiktiraf palsu olh menteri KOMEDI. Dak2 walanon pulak koyak rabak sampai minta\xe2\x80\xa6',mmg kelakar janji ph masa kempen pru15 iktiraf palsu olh menteri komedi dak2 walanon pulak koyak rabak,2
898,2023-01-03 04:52:50,b'Sidang ahli meringankan ini genrenya komedi apa gimana sih. Isinya lawak dan ketawa semua. Kan gue ikut ketawa\xf0\x9f\x98\x82\xf0\x9f\x98\x82',sidang ahli ringan genre komedi apa gimana sih isi lawak ketawa semua gue ikut,2
