,datetime,text,cleanTweet,emotion
522,2023-01-03 12:24:45,b'ges tlg rekomen drakor dong yang genre komedi...',ges tlg rekomen drakor dong genre komedi,2
523,2023-01-03 12:23:36,b'Komik yang luar biasa ini harus mendapat perhatian lebih!\n \n#comic #komikon #komikindonesia #komedi\n\nhttps://t.co/oODJQ0Hfjr https://t.co/21liovTraL',komik luar biasa dapat perhati,2
524,2023-01-03 12:22:59,b'Indonesian Idol kaya acara komedi anjirr gua ngakak banget dari tadiii \xf0\x9f\x98\xad\xf0\x9f\xa4\xa3\xf0\x9f\xa4\xa3',indonesian idol kaya acara komedi anjirr gua ngakak banget tadi,2
525,2023-01-03 12:22:55,"b'RT @kompasiana: Sinopsis Shotgun Wedding, Komedi Aksi Romantis yang Dibintangi oleh Josh Duhamel dan Jennifer Lopez #headline\nhttps://t.co/\xe2\x80\xa6'",sinopsis shotgun wedding komedi aksi romantis bintang josh duhamel jennifer lopez,2
526,2023-01-03 12:22:29,b'Banyak beut drama loh \n\nPuncak komedi bestie wkwkwk',banyak beut drama loh komedi bestie wkwkwk,2
527,2023-01-03 12:22:18,b'puncak komedi sekali hidup seorang melya',puncak komedi sekali hidup orang melya,2
528,2023-01-03 12:21:39,b'Puncak komedi pasti dino adeknya wonu\xf0\x9f\x98\xad https://t.co/eXUMqX6vx1',puncak komedi dino adeknya,2
529,2023-01-03 12:21:01,b'@adjisdoaibu @rndy11 Saat pikiran dah numpak dan keadaan2 sekitar seperti sedang tidak ramah kepada kita. Obat terbaik dari itu semua selain mencoba memasrahkan diri pada yang kuasa ya mencoba menghibur diri dengan komedi.',pikir dah numpak keadaan2 sedang ramah obat baik semua coba pasrah diri kuasa coba hibur diri komedi,2
530,2023-01-03 12:20:47,b'@convomf puncak komedi',puncak komedi,1
531,2023-01-03 12:20:13,"b'@JPFBASE Grand Blue masih memegang tahta untuk komedi absurd, kalau komedi dengan gaya alias sistematis dan keren pastinya Kaguya-sama wa Kokurasetai. \xf0\x9f\x91\x8d'",grand blue pegang tahta komedi absurd kalau komedi gaya alias sistematis keren pasti wa kokurasetai,2
532,2023-01-03 12:19:58,b'hari ini genrenya komedi anjir gue capek ngakak https://t.co/OwEwRWPbfE',hari genre komedi anjir gue capek ngakak,1
533,2023-01-03 12:18:45,b'@ARTIST_EUNJl Wkwkwk gapapa soalnya bohyun oppa juga tukang mabok g.\nIyaah bener itu tuh komedi tapi pas ada pesan moralnya kaya ttg keluarga gitu menyentuh banget \xf0\x9f\xa5\xb2\nIni nanti 10 episode apa 12 episode sih njii?',wkwkwk gapapa soal bohyun oppa tukang mabok bener tuh komedi pas pesan moral kaya ttg keluarga gitu sentuh banget episode apa episode sih njii,2
534,2023-01-03 12:18:25,b'@pluviophilejoys hidup kita adalah komedi',hidup komedi,2
535,2023-01-03 12:18:15,b'Percayalah padaku! Kamu akan kecanduan cerita ini!\n \n#komikon #komiket #dagelan #komedi\n\nhttps://t.co/bHjaqCRwzh https://t.co/Ka4evdSlsJ',percaya kamu candu cerita,1
536,2023-01-03 12:18:12,b'pala w muter-muter seperti komedi putarr',pala w komedi putarr,2
537,2023-01-03 12:17:04,b'@Cyepaa Hidup ini mmg penuh komedi cyep',hidup mmg penuh komedi cyep,2
538,2023-01-03 12:16:26,b'@19999z gw baca ini di kelas komedi bgt asli \xf0\x9f\x98\xb9',gw baca kelas komedi bgt asli,2
539,2023-01-03 12:15:04,b'Puncak komedi https://t.co/fvveWOqEPN https://t.co/0qCHXvA6mD',puncak komedi,1
540,2023-01-03 12:14:41,"b'@jurgnal Aku orangnya random sih ya, tapi lebih suka yang genre misteri, thriller, komedi, fantasi gitu. Eh, waktu itu nonton drachin Luoyang sampe selesai karena waktu itu ikut on going dan storylinenya itu bagus sih ya menurut aku loh.\xf0\x9f\x98\x82'",aku orang random sih lebih suka genre misteri thriller komedi fantasi gitu eh waktu nonton drachin luoyang sampe selesai waktu ikut on going storylinenya bagus sih aku,2
541,2023-01-03 12:14:12,b'@scriptshe Wkwkwkw keknya semua live ada mereka bertiga pasti lucu wkwkw akhir2 ini anak2 kalau live kek vc ama pacara. Gw kgn nonton live tp berasa nonton komedi lenong kek gini',wkwkwkw kek semua live tiga lucu wkwkw akhir2 anak2 kalau live kek vc ama pacara gw kgn nonton live tp asa nonton komedi lenong kek gin,2
542,2023-01-03 12:14:03,"b'@bukantemenmuitu Hahhahahahah komedi komedi\nTapi ini hitungannya bersih ga sih, kan katanya stuck on ur body tuh 3 months'",hahhahahahah komedi hitung bersih ga sih kata stuck on ur body tuh months,2
543,2023-01-03 12:13:48,b'Komedi ya...:)))) https://t.co/1IyA1yVysc',komedi,1
544,2023-01-03 12:13:18,"b'@rentfess sender! kalau kamu mencari yang bawel aku adalah pilihan yang amat sangat super duper tepat untuk kamu, aku bisa banget untuk mendengarkan segala keluh kesah kamu dan kalau kamu butuh nanti aku akan memberikan kamu hiburan hiburan dari celotehan aku yang kadang isinya komedi\n\n-'",kalau kamu cari bawel aku pilih sangat super duper tepat kamu aku banget dengar segala keluh kesah kamu kalau kamu butuh aku beri kamu hibur hibur celoteh aku kadang isi,2
545,2023-01-03 12:12:21,"b'@UMonline So? Ada je yang kerja 7 hari seminggu, gaji masih seribu lebih je.. \n\nKalau ikut logik, gaji ratus ribu kena la kena sokmo'",je kerja hari minggu gaji ribu lebih je ikut logik gaji ratus ribu kena kena sokmo,2
546,2023-01-03 12:11:59,b'alias wkwkwkwkwk yakali org kaya lu punya tmn pinter wkwk. si paling nolep kan lu wkwkwkw puncak komedi',alias wkwkwkwkwk yakali org kaya lu punya tmn pinter wkwk si paling nolep lu wkwkwkw puncak komedi,2
547,2023-01-03 12:11:10,b'hidup ku komedi dr kmrn @pusingmnsungbn https://t.co/UVfxyGdNQl https://t.co/lQAc67InM4',hidup ku komedi kmrn,2
548,2023-01-03 12:09:04,"b'Atas usaha gigih beliau, pada tahun 2021 beliau telah berjaya menjadi salah satu perserta solo program komedi Astro iatu Mencari Sepahtu Yang Hilang.'",atas usaha gigih beliau tahun beliau jaya jadi salah satu serta solo program komedi astro iatu cari sepahtu hilang,1
549,2023-01-03 12:09:03,"b'DEMI LUCU\n\n\xe2\x80\x98Line up\xe2\x80\x99 kita yang pertama: MUSLIM ROSLI, Naib Juara Awesome Raja Lawak\n\nMenjadikan pentas Stendap Komedi sebagai satu platform untuk memulakan langkah pertama dalam bidang komedi pada tahun 2018. https://t.co/82lvFh1iwY'",muslim rosli naib juara awesome raja pentas stendap komedi satu platform mula langkah pertama bidang komedi tahun,2
550,2023-01-03 12:08:38,b'Pura pura bahagia setiap jadi badut nya kalian.\nBiar sifat kalian yang gengsian dan ego number one itu hilang dulu dengan ngolok ngolok dan bercandain kesalahan saya yang lalu\xc2\xb2 \n\nKomedi banget ya saya? https://t.co/k0GoftSRJ4',pura pura bahagia jadi badut nya sifat kalian gengsi ego number one hilang dulu ngolok ngolok bercandain salah banget,2
551,2023-01-03 12:08:09,"b'Sampe kevin ketemu sama emily (isis hainsworth) pemain cello di sekolahnya dan mengajak emily buat gabung, tapi selain ada komedi khas film barat, di film ini juga ada romance antara emily sama kevin wkwk https://t.co/92qUOpR5f4'",sampe kevin ketemu sama emily main cello sekolah ajak emily buat gabung komedi khas film barat film romance emily sama kevin wkwk,2
552,2023-01-03 12:07:17,b'@xtrendci Komedi resmen \xf0\x9f\xa4\x94',komedi resmen,2
553,2023-01-03 12:07:16,b'Poencak komedi',poencak komedi,2
554,2023-01-03 12:07:04,"b'Sinopsis Shotgun Wedding, Komedi Aksi Romantis yang Dibintangi oleh Josh Duhamel dan Jennifer Lopez #headline\nhttps://t.co/4c0SmBLaTC'",sinopsis shotgun wedding komedi aksi romantis bintang josh duhamel jennifer lopez,2
555,2023-01-03 12:06:16,"b'Seru bgt baru ep 1, ini tuh komedi romantis ya? Kepo bgt sama 4 orang ini bisa ketemu dimana, meski kerja di industri yg sama, tp mereka kerja di tempat yg berbeda2 dan profesi yg beda pula. Serunya mereka suportif bgt eehh'",seru bgt baru ep tuh komedi romantis kepo bgt sama orang ketemu meski kerja industri sama tp kerja tempat berbeda2 profesi beda seru suportif bgt eehh,2
556,2023-01-03 12:05:37,b'@Kevinniii hidup lu komedi bgt',hidup lu komedi bgt,2
557,2023-01-03 12:05:16,b'@mxtx_fess Liu qingge x shen qingqiu\nKutunggu jandamu bro\nModern setting\nPov lqg yg nunggu temennya aka sqq cerai/putus dri binghe awowkwok. Prefer narasi komedi gajelas aja \nId/eng ok',liu qingge x shen janda lqg nunggu temennya aka sqq dri binghe awowkwok prefer narasi komedi gajelas aja,2
558,2023-01-03 12:05:00,b'anime komedi terlucu menurut kalian apa? kalo menurut sender saiki kusuo \xf0\x9f\xa5\xb2\xf0\x9f\xa5\xb2\xf0\x9f\xa5\xb2 ga kuat absurd banget mana temen temennya pada sinting \xf0\x9f\x98\xad\xf0\x9f\x98\xad\xf0\x9f\x98\xad *jpf https://t.co/mhey1NzFnV',anime komedi lucu kalian apa kalo sender saiki kusuo ga kuat absurd banget mana temen temennya sinting,2
559,2023-01-03 12:03:30,"b'ganti2 tergantung mood, tp skrg lg suka komedi sama sol https://t.co/maMag4MdAa'",ganti2 gantung mood tp skrg lg suka komedi sama sol,2
560,2023-01-03 12:03:27,b'@hendwei609 @devdevinaaaa @Askrlfess Komedi komedi komedi wkwkwkwkwkkwkwkwkk https://t.co/2Avbsl9tKv',komedi komedi komedi wkwkwkwkwkkwkwkwkk,0
561,2023-01-03 12:01:11,b'@mrkklvc INI PUNCAK KOMEDI BANGETTTTT WKWKWKWKKWKWKWKWKKWK',puncak komedi bangett wkwkwkwkkwkwkwkwkkwk,2
562,2023-01-03 11:59:52,b'Kalakuan anu meuli paku \n\n#cangehgarrr #caritangenahdansegar #bobodoransunda #sundalucu #sunda #bandung #gedungsate #trending #iklas #lokalpride #komedi https://t.co/DcaAJ08qJa',kalakuan meuli paku,1
563,2023-01-03 11:59:45,b'@minie__min seller tokped. komedi banget sumpah kayak mancing emosi banget tapi ujung2nya pas diancem balik malahan baik-baikin. najong!\n\naamiin! plis lebih banyak ketemu ya kita\xf0\x9f\xab\xb6\xf0\x9f\x8f\xbc\xf0\x9f\xab\xb6\xf0\x9f\x8f\xbc\xf0\x9f\xab\xb6\xf0\x9f\x8f\xbc',seller tokped komedi banget sumpah kayak mancing emosi banget ujung2nya pas diancem balik malah plis lebih banyak ketemu,2
564,2023-01-03 11:59:29,b'@anznayla_ DI MDRSHHHHH AWOAKWOWKOWKWKKK KOMEDI',mdrshh awoakwowkowkwkk komedi,1
565,2023-01-03 11:58:39,b'@onestaars puncak komedi \xf0\x9f\x98\xad\xf0\x9f\x98\xad\xf0\x9f\x98\xad',puncak komedi,1
566,2023-01-03 11:57:21,"b'Nggak mau tertipu teaser, isinya pasti komedi https://t.co/2OF6tUtFOt'",mau tipu teaser isi komedi,2
567,2023-01-03 11:55:42,"b'RT @rndy11: Komedi menyelamatkan hidup.\n\nBener bang, cukup gini aja kita \xe2\x9d\xa4\xef\xb8\x8f'",komedi selamat bang cukup gin aja,2
568,2023-01-03 11:53:26,b'Percayalah padaku! Kamu akan kecanduan cerita ini!\n \n#komiker #komiklokalindonesia #komedi #komikindo\n\nhttps://t.co/QBtveubo7x https://t.co/dpfv1jqcKl',percaya kamu candu cerita,1
569,2023-01-03 11:50:54,"b'Menyemangati orng lain bisa tapi nyemangatin diri sendiri sampe mau mati susah bener \xf0\x9f\xa4\xa3, \nKocak bangt komedi ini \xf0\x9f\x99\x82'",semangat orng nyemangatin diri sendiri sampe mau mati susah bener bangt komedi,2
570,2023-01-03 11:50:35,b'@collegemenfess Uas ku kalo dijadiin buku genrenya komedi',uas ku kalo dijadiin buku genre komedi,2
571,2023-01-03 11:50:24,"b'@indomyfess Namjoon, masak nasi goreng yg simple aja, karena ini acara komedi harus ada bahan lawakan kan, kayaknya namjoon partner yg pas'",namjoon masak nasi goreng simple aja acara komedi bahan lawa kayak namjoon partner pas,2
572,2023-01-03 11:50:20,b'malah jadi komedi tai\xf0\x9f\x98\x82\xf0\x9f\x98\x82\xf0\x9f\x98\x82\xf0\x9f\x98\x82\xf0\x9f\x98\x82 yoasobi km nyesel gk notis orang aneh',malah jadi komedi yoasobi km nyesel not orang aneh,2
573,2023-01-03 11:49:41,b'Komedi emang healing paling gampang ga perlu banyak usaha cukup nonton atau dengerin https://t.co/jUBIzClDpp',komedi emang healing paling gampang ga perlu banyak usaha cukup nonton dengerin,2
574,2023-01-03 11:48:40,"b'@mftiskandar @premierleague Liverpool emang idola, peningkat mood bahagia. Komedi tengah malam tenan \xf0\x9f\xa4\xa3\xf0\x9f\xa4\xa3\xf0\x9f\xa4\xa3'",liverpool emang idola tingkat mood bahagia komedi tengah malam tenan,1
575,2023-01-03 11:48:10,b'puncak komedi kalo kata coki https://t.co/cPk9U7E7S0',puncak komedi kalo kata cok,2
576,2023-01-03 11:47:40,"b'Dunia adalah komedi bagi mereka yan memikirkannya, atau tragedi bagi mereka yang merasakannya. (Harace Walpole)'",dunia komedi yan pikir tragedi rasa,2
577,2023-01-03 11:47:12,b'@xiwangfu menemukan sebuah komedi lucu \xf0\x9f\xa4\xa3\xf0\x9f\xa4\xa3\xf0\x9f\xa4\xa3',temu buah komedi lucu,2
578,2023-01-03 11:47:07,"b'@velynatalia_ seru pol kek mr. queen, tapi lek dari segi komedi lebih ngakak mr. queen, worth to watch karna tiap episode pasti plot twistttttt'",seru pol kek mr queen lek segi komedi lebih ngakak mr queen worth to watch karna tiap episode plot twistt,2
579,2023-01-03 11:46:48,b'Lucu seperti dipuncak komedi https://t.co/j7HdV6k2TI https://t.co/nP5POAmXpw',lucu puncak komedi,2
580,2023-01-03 11:46:18,b'Komik yang luar biasa ini harus mendapat perhatian lebih!\n \n#komikindo #comic #manhwa #komedi\n\nhttps://t.co/Dfv8D6IMEt https://t.co/98t6s4WWxV',komik luar biasa dapat perhati,2
581,2023-01-03 11:46:04,b'Aku suka gaya gambar Nona Kelinci Milik Tuan Serigala! Bagus banget! Desain karakternya juga hebat! Pantas untuk direkomendasikan!\n \n#komikstrip #komikharian #komiklokal #komedi\n\nhttps://t.co/jgvTekoDAx https://t.co/j30U1CTDdO',aku suka gaya gambar nona kelinci milik tuan bagus desain karakter pantas,1
582,2023-01-03 11:45:00,b'wkwkwk ga jadi ngobatin kalo kaya gitu mah\n\n https://t.co/VsDNp8z3PG',wkwkwk ga jadi ngobatin kalo kaya gitu,2
583,2023-01-03 11:43:46,b'@lieberrte @animefess_ Lah bener kan komedi dewasa WKWK',lah bener komedi dewasa wkwk,1
584,2023-01-03 11:43:07,"b'@sympaticst Demenan gue sih series Love-Live.. Anime idol school gitu. Ada juga anime komedi, judulnya Nichijou! Film sih, cobain fantasy deh contohnya The School for Good and Evil. Selamat menonton. ;)'",demen gue sih series anime idol school gitu anime komedi judul film sih cobain fantasy deh contoh the school for good and evil selamat tonton,2
585,2023-01-03 11:43:00,b'@GF_Rayn11 fantasi dan komedi si hrus baca karna realita ny ga seindah itu wkwk',fantasi komedi si hrus baca karna realita ny ga indah wkwk,2
586,2023-01-03 11:41:49,b'Aku tidak sabar menunggu apa yang terjadi selanjutnya! Klik tautan di bawah ini dan bergabunglah dengan penderitaanku!\n \n#Bahasaindonesia #komikislam #komedi #indiecomics\n\nhttps://t.co/932iK6Bbtw https://t.co/nN9uw5Nkdb',aku sabar tunggu apa jadi klik taut bawah gabung,2
587,2023-01-03 11:38:46,b'@caledunla puncak komedi',puncak komedi,1
588,2023-01-03 11:37:54,b'Nonton anime komedi malah baper anjim knpsi gue?!',nonton anime komedi malah baper anjim knpsi,2
589,2023-01-03 11:36:02,"b'@adjisdoaibu @rndy11 Sam, healingku ya nonton komedi, entah formatnya apa saja, \nBtw sukkses slalu Bang @adjisdoaibu yang berlimpah doa dari sang ibu \xf0\x9f\x99\x8f'",sam healingku nonton komedi entah format apa sukkses slalu bang limpah doa sang ibu,2
590,2023-01-03 11:34:02,b'@sirembuIan @apoxxmine @fessthai Kalo endingnya diketawain aja sebenarnya bisa jadi komedi\xf0\x9f\x91\x8d',kalo endingnya diketawain aja benar jadi,1
591,2023-01-03 11:32:49,b'Kalo kamu merasa post ini bermanfaat:\n1. Follow saya di @dionharyadi untuk konten seputar gizi &amp; kebugaran (dan komedi bapak2).\n\n2. Share ke satu temanmu yang membutuhkan konten ini.',kalo kamu rasa post follow konten putar gizi bugar komedi share satu teman butuh konten,2
592,2023-01-03 11:31:17,b'Nonton film komedi dulu ialangin rasa steress',nonton film komedi dulu ialangin rasa steress,1
593,2023-01-03 11:31:16,b'Menjelang pilstress 2024 banyak yg komedi terus hehehehehe https://t.co/53Sxg40Mpt',jelang pilstress banyak komedi terus hehehehehe,2
594,2023-01-03 11:30:27,"b'@moviemenfes Bagus, action komedi sedikit gore... \xf0\x9f\x98\x81'",bagus action komedi sedikit gore,2
595,2023-01-03 11:29:30,b'@kaelakovalskia Sya gx tau apa yg terjadi karna saya telat pastinya banyak komedi ini',sya gx tau apa jadi karna telat pasti banyak komedi,2
596,2023-01-03 11:27:59,"b'@lofyo1 Di nomor 3 harusnya ad komedi jg, tp lupa td \xf0\x9f\x98\xad'",nomor harus ad komedi jg tp lupa td,2
597,2023-01-03 11:24:56,b'@mukaikhlas komedi romance bisa kali ya tahun ini',komedi romance kali tahun,2
598,2023-01-03 11:24:32,"b'hdup gwe komedi bgt, msih awal tahun udh kna cakar kucing hhshshsh,,'",hdup gwe komedi bgt msih awal tahun udh kna cakar kucing hhshshsh,1
599,2023-01-03 11:24:32,b'makin hari makin komedi \xf0\x9f\x98\xbc https://t.co/BdmeGGZFXb',makin hari makin komedi,2
600,2023-01-03 11:23:37,b'Aku suka gaya gambar Kembalinya Dewi Siluman! Bagus banget! Desain karakternya juga hebat! Pantas untuk direkomendasikan!\n \n#komedi #manhua #komikindonesia #komiklucu\n\nhttps://t.co/YA31a9arhv https://t.co/zLrkUAqbmN',aku suka gaya gambar kembali dewi bagus desain karakter pantas,2
601,2023-01-03 11:22:53,"b""Membuka 2023 dengan artikel 'Rock Bro: Naratif Komedi Tragis' dalam buku 'Satira: Bicara Filem Dunia Wayang' (terbitan Kuali Hitam Enterprise).\n\nUntuk mendapatkan buku ini,boleh hubungi penyelenggaranya @AinaSaaid yang menyambut birthday hari ni. Pibeday,\xf0\x9f\x90\xb0! https://t.co/o84MumPAlO""",artikel rock naratif komedi tragis buku bicara filem dunia wayang kuali hitam dapat buku hubung selenggara sambut birthday hari ni,2
602,2023-01-03 11:22:33,"b'Blom pernah ada yg tak menarik dlm hidup. Di dlm tampilan seorang yg paling culun skalipun, ada drama, komedi &amp; tragedi.'",blom pernah tarik dlm hidup dlm tampil orang paling culun skalipun drama komedi tragedi,2
603,2023-01-03 11:21:41,b'Ais sama Syifa keknya kalo  dapat projects bareng lg Cocok tuh main drama komedi mereka satu server soalnya \xf0\x9f\xa4\xa3\xf0\x9f\xa4\xa3#TajwidCinta',ais sama syifa kek kalo projects bareng lg cocok tuh main drama komedi satu server soal,2
604,2023-01-03 11:21:25,"b'@lehagape @PASPusat Kesian org cina, esok PRN tolong pacak bendera PKR &amp; UMNO sahaja la. Org cina jadi balaci DSAI &amp; Zahid Komedi'",kesi org cina esok pacak bendera pkr umno sahaja org cina jadi balaci dsai zahid komedi,2
605,2023-01-03 11:21:16,b'Aku tidak sabar menunggu apa yang terjadi selanjutnya! Klik tautan di bawah ini dan bergabunglah dengan penderitaanku!\n \n#komikon #komedi #komikstrip #komiket\n\nhttps://t.co/8b03gWT7E5 https://t.co/qvcwauiTW2',aku sabar tunggu apa jadi klik taut bawah gabung,2
606,2023-01-03 11:20:49,b'@sounararara @akunnalzio NGAKAKAKAK AJG KOMEDI',ngakakakak ajg komedi,2
607,2023-01-03 11:20:44,b'komedi ga kalau gw dijodohin sama lulusan kuliah di madinah',komedi ga kalau gw dijodohin sama lulus kuliah madinah,2
608,2023-01-03 11:19:46,b'AWAL TAHUN KOMEDI BGT',awal tahun komedi bgt,2
609,2023-01-03 11:18:55,b'komedi hari ini~ https://t.co/kpX9h6wZYr',komedi hari,1
610,2023-01-03 11:18:16,b'gk jelas dah lu katanya rr buat yg ngerjain task doang tp ttp di boost PUNCAK KOMEDI AYO SEMUANYA KETAWA \xf0\x9f\x91\x8f\xf0\x9f\x8f\xbb\xf0\x9f\x91\x8f\xf0\x9f\x8f\xbb\xf0\x9f\x91\x8f\xf0\x9f\x8f\xbb\xf0\x9f\x91\x8f\xf0\x9f\x8f\xbb\xf0\x9f\x91\x8f\xf0\x9f\x8f\xbb\xf0\x9f\x91\x8f\xf0\x9f\x8f\xbb\xf0\x9f\x91\x8f\xf0\x9f\x8f\xbb',jelas dah lu kata rr buat ngerjain task doang tp ttp boost puncak komedi ayo semua ketawa,2
611,2023-01-03 11:16:56,b'@yourxtrex Jadikan sbgi komedi kan?\xf0\x9f\x98\x8e',jadi sbgi komedi,1
612,2023-01-03 11:15:00,b'hahaha dikerjain anak bocah\xf0\x9f\x98\x82 \n\n https://t.co/YdjYAuYMIq',hahaha dikerjain anak,2
613,2023-01-03 11:13:59,b'Komik yang luar biasa ini harus mendapat perhatian lebih!\n \n#Indonesia #komedi #komikstrip #komikon\n\nhttps://t.co/MX5XbAYDcI https://t.co/321xDGa13P',komik luar biasa dapat perhati,2
614,2023-01-03 11:12:55,b'Anime ini sangat layak untuk dibaca! Ayo periksa!\n \n#komedi #Indonesia #komikharian #komikon\n\nhttps://t.co/JKuHvE8tqv https://t.co/xP2WI1Qlev',anime sangat layak ayo,2
615,2023-01-03 11:11:18,b'komedi banget dah',komedi banget dah,2
616,2023-01-03 11:10:53,"b'episode 3, ngejelasin dinamika soonhoon.\n\ndinamikanya: cowo klamar klemer!nyongi x workaholic!uji. ini tuh bakalan seru banget karena isinya full komedi di tiap panelnya. isinya tingkah lucu dan konyolnya nyongi.\n\n(sekali lagi maaf ga bisa nulisin ini ya)'",episode ngejelasin dinamika cowo klamar x tuh bakal seru banget isi full komedi tiap panel isi tingkah lucu konyol maaf ga nulisin,2
617,2023-01-03 11:10:42,"b'@kdrama_menfess mau tiga ini, drama komedi era kerajaan https://t.co/HNAQxqXFLY'",mau tiga drama komedi era raja,1
618,2023-01-03 11:09:26,"b'Hidup itu kayak komedi animasi angry birds; Selalu aja ada babi yg ketawa saat kita terjatuh.. \xf0\x9f\x98\xa5 @ Ketep, Jawa Tengah, Indonesia https://t.co/EO9VKZKZ6P'",hidup kayak komedi animasi angry selalu aja babi ketawa jatuh ketep jawa tengah indonesia,2
619,2023-01-03 11:07:32,b'@satbbang @moviemenfes nonton ini bukannya pada takut tapi pada ketawa semua \xf0\x9f\x98\xad\xf0\x9f\x98\xad\xf0\x9f\x98\xad\xf0\x9f\x98\xad\xf0\x9f\x98\xad tapi emang aseulii komedi nya parah sih \xf0\x9f\x98\xad\xf0\x9f\x92\x94',nonton bukan takut ketawa semua emang aseulii komedi nya parah sih,1
620,2023-01-03 11:06:25,b'@kazeaah ini semua juga bagus bagus (kalo mau komedi yang ngakak tp rada bikin malu coba baca the h0ly id0l &amp; the mach0 florist) https://t.co/aRhO9si3TV',semua bagus bagus mau komedi ngakak tp rada bikin malu coba baca the h0ly id0l the mach0,2
621,2023-01-03 11:06:18,b'@adrenlee_ @moviemenfes iya betul pee mak wkwk kebanyakan horor thai komedi semua sih yah \xf0\x9f\x98\xad\xf0\x9f\x98\xad ditambah kalo nontonnya bareng temen',iya betul pee mak wkwk banyak horor thai komedi semua sih yah tambah kalo nontonnya bareng temen,2
622,2023-01-03 11:06:12,b'@alyakbar__ @MamatAlkatiri Wkwk komedi \xf0\x9f\xa4\xa3',wkwk komedi,1
623,2023-01-03 11:05:17,"b'Jurus hilangkan galau: -menonton film atau komedian, kalo nonton film ato komedi biar gak galau film yg bertema happy, kalo komedi misal OPJ bagus juga.'",jurus hilang film komedian kalo nonton film ato komedi biar galau film tema happy kalo komedi misal opj bagus,2
624,2023-01-03 11:02:01,b'@abdoolamunir Komedi king',komedi king,1
625,2023-01-03 11:01:59,b'puncak komedi sekali.',puncak komedi sekali,2
626,2023-01-03 11:01:33,b'Aku tidak sabar menunggu apa yang terjadi selanjutnya! Klik tautan di bawah ini dan bergabunglah dengan penderitaanku!\n \n#komedi #comics #Indonesia #komiklucu\n\nhttps://t.co/EAwiccQ7t6 https://t.co/I8IpBfh8Sv',aku sabar tunggu apa jadi klik taut bawah gabung,2
627,2023-01-03 11:01:13,"b'@moviemenfes ingetnya scream, bukan lucu apa yah kek apa bagusnya sih sebenernya, jd pas selesai nonton yah ngetawain diri sendiri \xf0\x9f\x98\x94 hebat nonton ampe selesai, kalo horor yg emang komedi itu horor thai pastinya wkwk pernah sampe ngompol ditambah ngetawain temenku yg kagetan \xf0\x9f\x98\xad\xf0\x9f\x98\xad'",ingetnya scream bukan lucu apa yah kek apa bagus sih sebenernya jd pas selesai nonton yah ngetawain diri sendiri hebat nonton ampe selesai kalo horor emang komedi horor thai pasti wkwk pernah sampe ngompol tambah ngetawain temenku kaget,2
628,2023-01-03 11:00:33,b'@thestorykids @Stray_Kids Apa gara2 fw yang berujung komedi lalu di qrt akun official rcti yg tadi kah \xf0\x9f\x98\xad\xf0\x9f\xa4\xa3',apa gara2 fw ujung komedi lalu qrt akun official rcti tadi,2
629,2023-01-03 10:58:17,b'Komedi terus nih mba nya \xf0\x9f\xa4\xa3 https://t.co/hWKZTHKP6w',komedi terus nih mba nya,0
630,2023-01-03 10:57:54,"b'wah puncak komedi, sepantesnya gua bilang ANJINGGGGG'",wah puncak komedi sepantesnya gua bilang anjingg,2
631,2023-01-03 10:57:50,b'@PhuttzLee @anthraxxx781 Dah macam slapstick komedi pula. kesian',dah macam slapstick komedi kesi,2
632,2023-01-03 10:56:42,"b'Semua, apalagi kalo sama temen auto berubah genre jadi komedi https://t.co/76BAa3WQIe'",semua kalo sama temen auto ubah genre jadi komedi,1
633,2023-01-03 10:56:29,b'hidup sprti di komedi putar alias ngentotttt',hidup sprti komedi putar alias ngentott,0
634,2023-01-03 10:56:16,"b'Katanya hidup ini panggung sandiwara, lha hidup aing kok malah jadi panggung srimulat, isinya komedi mulu...'",kata hidup panggung sandiwara lha hidup aing kok malah jadi panggung srimulat isi komedi mulu,2
635,2023-01-03 10:56:00,b'POINTS AND LAUGHS AT KAVETHAM DI PUNCAK KOMEDI \xf0\x9f\xab\xb5\xf0\x9f\xab\xb5\xf0\x9f\xab\xb5\xf0\x9f\xab\xb5\xf0\x9f\xab\xb5\xf0\x9f\xab\xb5 LOSERS (affectionate) \xe2\x80\x94 Anon u mood betul deh aku sangat terhibur. \xf0\x9f\x98\xad\xf0\x9f\x99\x8f\xf0\x9f\x8f\xbb https://t.co/Lh5ttHLlxU',points and laughs at kavetham puncak komedi losers anon u mood betul deh aku sangat hibur,2
636,2023-01-03 10:55:50,b'Cerita Lucu ala Papua (MOB Papua) - Nomor Kapolda #shorts #papua #jokes https://t.co/YQjMGdUJTB via @YouTube \n\n#shorts \n#shortsyoutube \n#jokes \n#papua \n#papuabarat \n#papuaindonesia \n#humor \n#lucu \n#komedi \n#videolucu \n#videolucuterbaru',cerita lucu ala papua nomor kapolda via,2
637,2023-01-03 10:55:33,"b'Hahahahaa langsung ngerasa di ulti ketika diajak tos, dan pas ku tanya knp, katanya krn pasangan itu kan cerminan diri jiaakkhhh, puncak dari segala puncak komedi pada sesi tlp kali ini'",hahahahaa langsung ngerasa ulti ajak tos pas ku tanya knp kata pasang cermin diri jiaakkhh puncak segala puncak komedi sesi tlp kali,2
638,2023-01-03 10:55:05,b'Cerita Lucu ala Papua (MOB Papua) - I Love You #shorts #papua #jokes https://t.co/akAteYaSOe via @YouTube \n\n#shorts \n#shortsyoutube \n#jokes \n#papua \n#papuabarat \n#papuaindonesia \n#humor \n#lucu \n#komedi \n#videolucu \n#videolucuterbaru',cerita lucu ala papua i love you via,2
639,2023-01-03 10:54:50,"b'Tua adalah menyadari klo Suju sebenernya sampingannya nyanyi, seriusnya di ranah komedi. https://t.co/0VS9lw0SMt'",tua sadar klo suju sebenernya samping nyanyi serius ranah komedi,1
640,2023-01-03 10:54:10,b'Cerita Lucu ala Papua (MOB Papua) - Selingkuh #shorts #papua #jokes https://t.co/XyJ7Vlelsb via @YouTube \n\n#shorts \n#shortsyoutube \n#jokes \n#papua \n#papuabarat \n#papuaindonesia \n#humor \n#lucu \n#komedi \n#videolucu \n#videolucuterbaru',cerita lucu ala papua selingkuh via,2
